{
  "normRef": { "doc": "ГОСТ Р 52290-2024", "clause": "п. 3.5; табл. Д.1" },
  "verification": "CuratorExtracted",
  "markers": ["GOST-009", "GOST-021"],
  "rules": [
    { "signs": "3.13, 3.14", "parameter": "length", "unit": "m", "multipleOf": 0.1 },
    { "signs": "3.15", "parameter": "length", "unit": "m", "multipleOf": 1.0 },
    { "signs": "3.16, 6.3.2, 8.1.2", "parameter": "distance", "unit": "m",
      "oneOf": [10, 15, 20, 25, 30, 40, 50, 60, 70, 80, 90, 100, 120, 150, 200, 250, 300] },
    { "signs": "6.9.1, 8.1.1, 8.1.3, 8.1.4, 8.2.1, 8.2.2, 8.2.5, 8.2.6", "parameter": "distance", "unit": "m",
      "oneOf": [10, 15, 20, 25, 30, 40, 50, 60, 70, 80, 90, 100, 120, 150, 200, 250, 300, 350, 400, 500, 600, 700, 800, 900],
      "kmRanges": [
        { "fromKm": 1, "toKm": 10, "toInclusive": true, "multipleOfKm": 0.1 },
        { "aboveKm": 10, "multipleOfKm": 1.0 }
      ] },
    { "signs": "6.10.1, 6.10.2, 6.12", "parameter": "distance", "unit": "km", "unitShownOnSign": false,
      "kmRanges": [
        { "fromKm": 0, "toKm": 10, "toInclusive": true, "multipleOfKm": 0.1 },
        { "aboveKm": 10, "multipleOfKm": 1.0 }
      ] },
    { "signs": "3.24, 3.25, 4.6, 4.7, 5.15.3, 5.15.8, 5.15.9, 6.2", "parameter": "speed", "unit": "km/h",
      "unitShownOnSign": false, "multipleOf": 10 },
    { "signs": "3.4, 8.11", "parameter": "mass", "unit": "t", "oneOf": [2, 4, 8, 10, 15, 20, 25] },
    { "signs": "3.11, 8.4.1", "parameter": "mass", "unit": "t",
      "oneOf": [1.5, 2, 2.5, 3, 3.5, 4, 4.5, 5, 6, 7, 8, 9, 10, 12, 15, 18, 20], "above20MultipleOf": 5 },
    { "signs": "3.12", "parameter": "mass", "unit": "t", "oneOf": [1.5, 2, 2.5, 3, 3.5, 4, 5, 6, 7, 8, 9, 10] },
    { "signs": "8.5.3, 8.5.7", "parameter": "daysOfWeek" },
    { "signs": "8.5.4 - 8.5.7", "parameter": "timeOfDay", "stepMinutes": 30 },
    { "signs": "8.5.8", "parameter": "months" },
    { "signs": "8.9.1", "parameter": "duration", "oneOfMinutes": [5, 10, 30], "fromHours": 1, "multipleOfHours": 1 },
    { "signs": "1.13 - 1.14", "parameter": "slope", "unit": "%", "multipleOf": 1 }
  ],
  "notes": [
    "На знаке 3.4 значение массы 3,5 т не наносят",
    "Для табличек 8.2.1, 8.2.5, 8.2.6, применяемых со знаком 6.4, линейная мера допускается кратной 0,1 м",
    "Скорость указана для «6.2»; знак 6.2.1 в списке отсутствует — проверить"
  ]
}
